{
  "schema_version": 2,
  "run_id": "task-4.0-harness-portatil-vendor-neutral-2026-09-18",
  "task_id": "4.0",
  "attempt": 1,
  "status": "done",
  "base_sha": "a8b77217cd713b4ef629d324e63934e05e589864",
  "patch_sha256": "8ca2393a2c35cc2fd1371f0d8fa7d351cd7bcd34c219fc10f4545632b887baff",
  "patch_ref": "evidence/task-4.0-harness-portatil-vendor-neutral/4.0.patch",
  "final_state_sha256": "e0fa1ac12a5632db9d7891b3b17c2bc9ccc84f7b60bbd78c53b8c7af77ec9dae",
  "coverage_regression": false,
  "review_verdict": "approved",
  "tests": [
    {
      "command": "go build ./...",
      "exit_code": 0,
      "output_sha256": "eebaab80b1d5a43142ef55ac3a918ad91ffaa8b3b15f9616382c64d9d405499a"
    },
    {
      "command": "go vet ./...",
      "exit_code": 0,
      "output_sha256": "48fd88df22060d6516fab1e0a2e2938c71592e75bbee8a613f49521bffbae4ae"
    },
    {
      "command": "go test ./...",
      "exit_code": 0,
      "output_sha256": "05e3c0f0962aab9500e1de756e745b0cd440899c2e7dab4133c92a0dc5072083"
    },
    {
      "command": "go test -v -tags=integration ./tests/integration/...",
      "exit_code": 0,
      "output_sha256": "04045e6b4224aee81aa0732d200e3aaf3e286a2b49496bf35b89caa2c203fec0"
    },
    {
      "command": "make lint",
      "exit_code": 0,
      "output_sha256": "8f1830859e9e250476268eda1cad5e400e13841519c9e1beb5c0f0973dfd97b9"
    },
    {
      "command": "bash scripts/check-policies-sync.sh",
      "exit_code": 0,
      "output_sha256": "128480c86cbdd1ac23eabb4726b52ecbf0ffef6fbe9746966e3394f2b022c48f"
    },
    {
      "command": "bash scripts/check-skills-sync.sh",
      "exit_code": 0,
      "output_sha256": "234430702293de5a5ac9b577dbfd8e8de8d715fea8cce41e8662afc54563f4cc"
    },
    {
      "command": "bash scripts/check-hooks-sync.sh",
      "exit_code": 0,
      "output_sha256": "66dda08abe9a564a6375743a0ffa1da779a1a57fe6e21335208cb1caef9443f8"
    },
    {
      "command": "bash scripts/check-scripts-sync.sh",
      "exit_code": 0,
      "output_sha256": "54a51375b68f6e12bc0bff8084f36bb3910820986e3e3c0d78565a9fe4e025e9"
    },
    {
      "command": "shellcheck --severity=warning scripts/sync-policies.sh scripts/check-policies-sync.sh",
      "exit_code": 0,
      "output_sha256": "19eaf43821a7660ec323a87c8457bf74823beb296c39f5e01aa8a683aa50f061"
    }
  ],
  "criteria": [
    {
      "id": "gate-fails-editing-mirror-and-deleting-canonical",
      "evidence_ref": "evidence/task-4.0-harness-portatil-vendor-neutral/integration-tests.log"
    },
    {
      "id": "claude-code-content-byte-identical-pre-migration",
      "evidence_ref": "evidence/task-4.0-harness-portatil-vendor-neutral/integration-tests.log"
    },
    {
      "id": "four-anti-orphan-registrations-present-and-gate-runs-on-push-and-pr",
      "evidence_ref": "evidence/task-4.0-harness-portatil-vendor-neutral/integration-tests.log"
    },
    {
      "id": "three-existing-sync-gates-remain-green",
      "evidence_ref": "evidence/task-4.0-harness-portatil-vendor-neutral/check-skills-sync.log"
    }
  ],
  "evidence": [
    "evidence/task-4.0-harness-portatil-vendor-neutral/build.log",
    "evidence/task-4.0-harness-portatil-vendor-neutral/vet.log",
    "evidence/task-4.0-harness-portatil-vendor-neutral/unit-tests.log",
    "evidence/task-4.0-harness-portatil-vendor-neutral/integration-tests.log",
    "evidence/task-4.0-harness-portatil-vendor-neutral/lint.log",
    "evidence/task-4.0-harness-portatil-vendor-neutral/check-policies-sync.log",
    "evidence/task-4.0-harness-portatil-vendor-neutral/check-skills-sync.log",
    "evidence/task-4.0-harness-portatil-vendor-neutral/check-hooks-sync.log",
    "evidence/task-4.0-harness-portatil-vendor-neutral/check-scripts-sync.log",
    "evidence/task-4.0-harness-portatil-vendor-neutral/shellcheck.log"
  ]
}
